{
  "name": "aeon-extras",
  "author": "aaronjmars",
  "repo": "aaronjmars/aeon-extras",
  "description": "Extra skills bundled by the Aeon framework author. (Placeholder fixture — not a real pack.)",
  "category": "meta",
  "tags": ["aeon", "core"],
  "version": "0.3.0",
  "verified": true,
  "featured": false,
  "skills_count": 5,
  "install_command": "./install-skill-pack aaronjmars/aeon-extras",
  "submitted_at": "2026-01-15T12:00:00Z",
  "license": "MIT"
}
